root@lamp-s-1vcpu-1gb-tor1-01:~# tcpdump -c 5 -i eth0
tcpdump: verbose output suppressed, use -v or -vv for full protocol decode
listening on eth0, link-type EN10MB (Ethernet), capture size 262144 bytes
20:40:09.337716 IP lamp-s-1vcpu-1gb-tor1-01.ssh > 198.96.85.163.49760: Flags [P.], seq 1312585981:1312586089, ack 2898619700, win 313, length 108
20:40:09.337810 IP lamp-s-1vcpu-1gb-tor1-01.ssh > 198.96.85.163.49760: Flags [P.], seq 108:144, ack 1, win 313, length 36
20:40:09.337887 IP lamp-s-1vcpu-1gb-tor1-01.ssh > 198.96.85.163.49760: Flags [P.], seq 144:252, ack 1, win 313, length 108
20:40:09.337946 IP lamp-s-1vcpu-1gb-tor1-01.ssh > 198.96.85.163.49760: Flags [P.], seq 252:288, ack 1, win 313, length 36
20:40:09.339244 IP lamp-s-1vcpu-1gb-tor1-01.ssh > 198.96.85.163.49760: Flags [P.], seq 288:468, ack 1, win 313, length 180
5 packets captured
9 packets received by filter
0 packets dropped by kernel
