20:53:46.344491 IP lamp-s-1vcpu-1gb-tor1-01.ssh > 198.96.85.163.49760: Flags [P.], seq 347476:347648, ack 181, win 435, length 172
20:53:46.344575 IP lamp-s-1vcpu-1gb-tor1-01.ssh > 198.96.85.163.49760: Flags [P.], seq 347648:347820, ack 181, win 435, length 172
20:53:46.344638 IP lamp-s-1vcpu-1gb-tor1-01.ssh > 198.96.85.163.49760: Flags [P.], seq 347820:347992, ack 181, win 435, length 172
20:53:46.344696 IP lamp-s-1vcpu-1gb-tor1-01.ssh > 198.96.85.163.49760: Flags [P.], seq 347992:348164, ack 181, win 435, length 172
20:53:46.344754 IP lamp-s-1vcpu-1gb-tor1-01.ssh > 198.96.85.163.49760: Flags [P.], seq 348164:348336, ack 181, win 435, length 172
20:53:46.344824 IP lamp-s-1vcpu-1gb-tor1-01.ssh > 198.96.85.163.49760: Flags [P.], seq 348336:348508, ack 181, win 435, length 172
20:53:46.344947 IP lamp-s-1vcpu-1gb-tor1-01.ssh > 198.96.85.163.49760: Flags [P.], seq 348508:348680, ack 181, win 435, length 172
20:53:46.345020 IP lamp-s-1vcpu-1gb-tor1-01.ssh > 198.96.85.163.49760: Flags [P.], seq 348680:348852, ack 181, win 435, length 172
20:53:46.375534 IP lamp-s-1vcpu-1gb-tor1-01.ssh > 198.96.85.163.49760: Flags [P.], seq 348852:349024, ack 181, win 435, length 172
20:53:46.591573 IP lamp-s-1vcpu-1gb-tor1-01.ssh > 198.96.85.163.49760: Flags [P.], seq 320488:321668, ack 181, win 435, length 1180
20:53:46.911590 IP 198.96.85.163.49760 > lamp-s-1vcpu-1gb-tor1-01.ssh: Flags [.], ack 328316, win 1025, length 0
20:53:46.911716 IP lamp-s-1vcpu-1gb-tor1-01.ssh > 198.96.85.163.49760: Flags [P.], seq 349024:349368, ack 181, win 435, length 344
20:53:46.911741 IP 198.96.85.163.49760 > lamp-s-1vcpu-1gb-tor1-01.ssh: Flags [.], ack 333820, win 1025, length 0
20:53:46.911765 IP 198.96.85.163.49760 > lamp-s-1vcpu-1gb-tor1-01.ssh: Flags [.], ack 339452, win 1025, length 0
20:53:46.911785 IP 198.96.85.163.49760 > lamp-s-1vcpu-1gb-tor1-01.ssh: Flags [.], ack 344956, win 1025, length 0
20:53:46.911814 IP 198.96.85.163.49760 > lamp-s-1vcpu-1gb-tor1-01.ssh: Flags [.], ack 349024, win 1025, length 0
20:53:46.911834 IP 198.96.85.163.49760 > lamp-s-1vcpu-1gb-tor1-01.ssh: Flags [P.], seq 181:217, ack 349024, win 1025, length 36
^C
2083 packets captured
2101 packets received by filter
18 packets dropped by kernel
