20:53:16.036746 IP lamp-s-1vcpu-1gb-tor1-01.ssh > 198.96.85.163.49760: Flags [P.], seq 641048:641220, ack 325, win 435, length 172
20:53:16.036823 IP lamp-s-1vcpu-1gb-tor1-01.ssh > 198.96.85.163.49760: Flags [P.], seq 641220:641392, ack 325, win 435, length 172
20:53:16.036910 IP lamp-s-1vcpu-1gb-tor1-01.ssh > 198.96.85.163.49760: Flags [P.], seq 641392:641564, ack 325, win 435, length 172
20:53:16.036983 IP lamp-s-1vcpu-1gb-tor1-01.ssh > 198.96.85.163.49760: Flags [P.], seq 641564:641736, ack 325, win 435, length 172
20:53:16.037077 IP lamp-s-1vcpu-1gb-tor1-01.ssh > 198.96.85.163.49760: Flags [P.], seq 641736:641908, ack 325, win 435, length 172
20:53:16.037171 IP lamp-s-1vcpu-1gb-tor1-01.ssh > 198.96.85.163.49760: Flags [P.], seq 641908:642080, ack 325, win 435, length 172
20:53:16.037275 IP lamp-s-1vcpu-1gb-tor1-01.ssh > 198.96.85.163.49760: Flags [P.], seq 642080:642252, ack 325, win 435, length 172
20:53:16.037363 IP lamp-s-1vcpu-1gb-tor1-01.ssh > 198.96.85.163.49760: Flags [P.], seq 642252:642424, ack 325, win 435, length 172
20:53:16.037457 IP lamp-s-1vcpu-1gb-tor1-01.ssh > 198.96.85.163.49760: Flags [P.], seq 642424:642596, ack 325, win 435, length 172
20:53:16.037545 IP lamp-s-1vcpu-1gb-tor1-01.ssh > 198.96.85.163.49760: Flags [P.], seq 642596:642768, ack 325, win 435, length 172
20:53:16.041072 IP 198.96.85.163.49760 > lamp-s-1vcpu-1gb-tor1-01.ssh: Flags [.], ack 622472, win 1025, length 0
20:53:16.041116 IP lamp-s-1vcpu-1gb-tor1-01.ssh > 198.96.85.163.49760: Flags [P.], seq 642768:642940, ack 325, win 435, length 172
20:53:16.041276 IP lamp-s-1vcpu-1gb-tor1-01.ssh > 198.96.85.163.49760: Flags [P.], seq 642940:643224, ack 325, win 435, length 284
20:53:16.041362 IP lamp-s-1vcpu-1gb-tor1-01.ssh > 198.96.85.163.49760: Flags [P.], seq 643224:643396, ack 325, win 435, length 172
20:53:16.041421 IP lamp-s-1vcpu-1gb-tor1-01.ssh > 198.96.85.163.49760: Flags [P.], seq 643396:643568, ack 325, win 435, length 172
20:53:16.041481 IP lamp-s-1vcpu-1gb-tor1-01.ssh > 198.96.85.163.49760: Flags [P.], seq 643568:643740, ack 325, win 435, length 172
20:53:16.041502 IP 198.96.85.163.49760 > lamp-s-1vcpu-1gb-tor1-01.ssh: Flags [.], ack 627976, win 1025, length 0
20:53:16.041625 IP lamp-s-1vcpu-1gb-tor1-01.ssh > 198.96.85.163.49760: Flags [P.], seq 643740:644024, ack 325, win 435, length 284
20:53:16.041733 IP lamp-s-1vcpu-1gb-tor1-01.ssh > 198.96.85.163.49760: Flags [P.], seq 644024:644196, ack 325, win 435, length 172
20:53:16.041782 IP 198.96.85.163.49760 > lamp-s-1vcpu-1gb-tor1-01.ssh: Flags [.], ack 633480, win 1025, length 0
20:53:16.041911 IP lamp-s-1vcpu-1gb-tor1-01.ssh > 198.96.85.163.49760: Flags [P.], seq 644196:644480, ack 325, win 435, length 284
20:53:16.041981 IP lamp-s-1vcpu-1gb-tor1-01.ssh > 198.96.85.163.49760: Flags [P.], seq 644480:644652, ack 325, win 435, length 172
20:53:16.042079 IP 198.96.85.163.49760 > lamp-s-1vcpu-1gb-tor1-01.ssh: Flags [.], ack 638984, win 1025, length 0
20:53:16.042089 IP lamp-s-1vcpu-1gb-tor1-01.ssh > 198.96.85.163.49760: Flags [P.], seq 644652:644824, ack 325, win 435, length 172
20:53:16.042205 IP lamp-s-1vcpu-1gb-tor1-01.ssh > 198.96.85.163.49760: Flags [P.], seq 644824:645108, ack 325, win 435, length 284
20:53:16.042242 IP 198.96.85.163.49760 > lamp-s-1vcpu-1gb-tor1-01.ssh: Flags [.], ack 642768, win 1025, length 0
20:53:16.042335 IP lamp-s-1vcpu-1gb-tor1-01.ssh > 198.96.85.163.49760: Flags [P.], seq 645108:645392, ack 325, win 435, length 284
20:53:16.042409 IP lamp-s-1vcpu-1gb-tor1-01.ssh > 198.96.85.163.49760: Flags [P.], seq 645392:645564, ack 325, win 435, length 172
20:53:16.042475 IP lamp-s-1vcpu-1gb-tor1-01.ssh > 198.96.85.163.49760: Flags [P.], seq 645564:645736, ack 325, win 435, length 172
20:53:16.042559 IP lamp-s-1vcpu-1gb-tor1-01.ssh > 198.96.85.163.49760: Flags [P.], seq 645736:645908, ack 325, win 435, length 172
20:53:16.042643 IP lamp-s-1vcpu-1gb-tor1-01.ssh > 198.96.85.163.49760: Flags [P.], seq 645908:646080, ack 325, win 435, length 172
20:53:16.042725 IP lamp-s-1vcpu-1gb-tor1-01.ssh > 198.96.85.163.49760: Flags [P.], seq 646080:646252, ack 325, win 435, length 172
20:53:16.042807 IP lamp-s-1vcpu-1gb-tor1-01.ssh > 198.96.85.163.49760: Flags [P.], seq 646252:646424, ack 325, win 435, length 172
20:53:16.042891 IP lamp-s-1vcpu-1gb-tor1-01.ssh > 198.96.85.163.49760: Flags [P.], seq 646424:646596, ack 325, win 435, length 172
20:53:16.042985 IP lamp-s-1vcpu-1gb-tor1-01.ssh > 198.96.85.163.49760: Flags [P.], seq 646596:646768, ack 325, win 435, length 172
20:53:16.043076 IP lamp-s-1vcpu-1gb-tor1-01.ssh > 198.96.85.163.49760: Flags [P.], seq 646768:646940, ack 325, win 435, length 172
20:53:16.043128 IP lamp-s-1vcpu-1gb-tor1-01.ssh > 198.96.85.163.49760: Flags [P.], seq 646940:647112, ack 325, win 435, length 172
20:53:16.043188 IP lamp-s-1vcpu-1gb-tor1-01.ssh > 198.96.85.163.49760: Flags [P.], seq 647112:647284, ack 325, win 435, length 172
20:53:16.043271 IP lamp-s-1vcpu-1gb-tor1-01.ssh > 198.96.85.163.49760: Flags [P.], seq 647284:647456, ack 325, win 435, length 172
20:53:16.043364 IP lamp-s-1vcpu-1gb-tor1-01.ssh > 198.96.85.163.49760: Flags [P.], seq 647456:647628, ack 325, win 435, length 172
20:53:16.043451 IP lamp-s-1vcpu-1gb-tor1-01.ssh > 198.96.85.163.49760: Flags [P.], seq 647628:647800, ack 325, win 435, length 172
20:53:16.043512 IP lamp-s-1vcpu-1gb-tor1-01.ssh > 198.96.85.163.49760: Flags [P.], seq 647800:647972, ack 325, win 435, length 172
20:53:16.043569 IP lamp-s-1vcpu-1gb-tor1-01.ssh > 198.96.85.163.49760: Flags [P.], seq 647972:648144, ack 325, win 435, length 172
20:53:16.043626 IP lamp-s-1vcpu-1gb-tor1-01.ssh > 198.96.85.163.49760: Flags [P.], seq 648144:648316, ack 325, win 435, length 172
20:53:16.043721 IP lamp-s-1vcpu-1gb-tor1-01.ssh > 198.96.85.163.49760: Flags [P.], seq 648316:648488, ack 325, win 435, length 172
20:53:16.043787 IP lamp-s-1vcpu-1gb-tor1-01.ssh > 198.96.85.163.49760: Flags [P.], seq 648488:648660, ack 325, win 435, length 172
20:53:16.043845 IP lamp-s-1vcpu-1gb-tor1-01.ssh > 198.96.85.163.49760: Flags [P.], seq 648660:648832, ack 325, win 435, length 172
20:53:16.043944 IP lamp-s-1vcpu-1gb-tor1-01.ssh > 198.96.85.163.49760: Flags [P.], seq 648832:649004, ack 325, win 435, length 172
20:53:16.044009 IP lamp-s-1vcpu-1gb-tor1-01.ssh > 198.96.85.163.49760: Flags [P.], seq 649004:649176, ack 325, win 435, length 172
20:53:16.044080 IP lamp-s-1vcpu-1gb-tor1-01.ssh > 198.96.85.163.49760: Flags [P.], seq 649176:649348, ack 325, win 435, length 172
20:53:16.044143 IP lamp-s-1vcpu-1gb-tor1-01.ssh > 198.96.85.163.49760: Flags [P.], seq 649348:649520, ack 325, win 435, length 172
20:53:16.044200 IP lamp-s-1vcpu-1gb-tor1-01.ssh > 198.96.85.163.49760: Flags [P.], seq 649520:649692, ack 325, win 435, length 172
20:53:16.044259 IP lamp-s-1vcpu-1gb-tor1-01.ssh > 198.96.85.163.49760: Flags [P.], seq 649692:649864, ack 325, win 435, length 172
20:53:16.044315 IP lamp-s-1vcpu-1gb-tor1-01.ssh > 198.96.85.163.49760: Flags [P.], seq 649864:650036, ack 325, win 435, length 172
20:53:16.044372 IP lamp-s-1vcpu-1gb-tor1-01.ssh > 198.96.85.163.49760: Flags [P.], seq 650036:650208, ack 325, win 435, length 172
20:53:16.044447 IP lamp-s-1vcpu-1gb-tor1-01.ssh > 198.96.85.163.49760: Flags [P.], seq 650208:650380, ack 325, win 435, length 172
20:53:16.044524 IP lamp-s-1vcpu-1gb-tor1-01.ssh > 198.96.85.163.49760: Flags [P.], seq 650380:650552, ack 325, win 435, length 172
20:53:16.044581 IP lamp-s-1vcpu-1gb-tor1-01.ssh > 198.96.85.163.49760: Flags [P.], seq 650552:650724, ack 325, win 435, length 172
20:53:16.044644 IP lamp-s-1vcpu-1gb-tor1-01.ssh > 198.96.85.163.49760: Flags [P.], seq 650724:650896, ack 325, win 435, length 172
20:53:16.044701 IP lamp-s-1vcpu-1gb-tor1-01.ssh > 198.96.85.163.49760: Flags [P.], seq 650896:651068, ack 325, win 435, length 172
20:53:16.044758 IP lamp-s-1vcpu-1gb-tor1-01.ssh > 198.96.85.163.49760: Flags [P.], seq 651068:651240, ack 325, win 435, length 172
20:53:16.044815 IP lamp-s-1vcpu-1gb-tor1-01.ssh > 198.96.85.163.49760: Flags [P.], seq 651240:651412, ack 325, win 435, length 172
20:53:16.044890 IP lamp-s-1vcpu-1gb-tor1-01.ssh > 198.96.85.163.49760: Flags [P.], seq 651412:651584, ack 325, win 435, length 172
20:53:16.044988 IP lamp-s-1vcpu-1gb-tor1-01.ssh > 198.96.85.163.49760: Flags [P.], seq 651584:651756, ack 325, win 435, length 172
20:53:16.045064 IP lamp-s-1vcpu-1gb-tor1-01.ssh > 198.96.85.163.49760: Flags [P.], seq 651756:651928, ack 325, win 435, length 172
20:53:16.045129 IP lamp-s-1vcpu-1gb-tor1-01.ssh > 198.96.85.163.49760: Flags [P.], seq 651928:652100, ack 325, win 435, length 172
20:53:16.045189 IP lamp-s-1vcpu-1gb-tor1-01.ssh > 198.96.85.163.49760: Flags [P.], seq 652100:652272, ack 325, win 435, length 172
20:53:16.045246 IP lamp-s-1vcpu-1gb-tor1-01.ssh > 198.96.85.163.49760: Flags [P.], seq 652272:652444, ack 325, win 435, length 172
20:53:16.045308 IP lamp-s-1vcpu-1gb-tor1-01.ssh > 198.96.85.163.49760: Flags [P.], seq 652444:652616, ack 325, win 435, length 172
20:53:16.045365 IP lamp-s-1vcpu-1gb-tor1-01.ssh > 198.96.85.163.49760: Flags [P.], seq 652616:652788, ack 325, win 435, length 172
20:53:16.045422 IP lamp-s-1vcpu-1gb-tor1-01.ssh > 198.96.85.163.49760: Flags [P.], seq 652788:652960, ack 325, win 435, length 172
20:53:16.045478 IP lamp-s-1vcpu-1gb-tor1-01.ssh > 198.96.85.163.49760: Flags [P.], seq 652960:653132, ack 325, win 435, length 172
20:53:16.045537 IP lamp-s-1vcpu-1gb-tor1-01.ssh > 198.96.85.163.49760: Flags [P.], seq 653132:653304, ack 325, win 435, length 172
20:53:16.045626 IP lamp-s-1vcpu-1gb-tor1-01.ssh > 198.96.85.163.49760: Flags [P.], seq 653304:653476, ack 325, win 435, length 172
20:53:16.045715 IP lamp-s-1vcpu-1gb-tor1-01.ssh > 198.96.85.163.49760: Flags [P.], seq 653476:653648, ack 325, win 435, length 172
20:53:16.045783 IP lamp-s-1vcpu-1gb-tor1-01.ssh > 198.96.85.163.49760: Flags [P.], seq 653648:653820, ack 325, win 435, length 172
20:53:16.045842 IP lamp-s-1vcpu-1gb-tor1-01.ssh > 198.96.85.163.49760: Flags [P.], seq 653820:653992, ack 325, win 435, length 172
20:53:16.045910 IP lamp-s-1vcpu-1gb-tor1-01.ssh > 198.96.85.163.49760: Flags [P.], seq 653992:654164, ack 325, win 435, length 172
20:53:16.046009 IP lamp-s-1vcpu-1gb-tor1-01.ssh > 198.96.85.163.49760: Flags [P.], seq 654164:654336, ack 325, win 435, length 172
20:53:16.046076 IP lamp-s-1vcpu-1gb-tor1-01.ssh > 198.96.85.163.49760: Flags [P.], seq 654336:654508, ack 325, win 435, length 172
20:53:16.046133 IP lamp-s-1vcpu-1gb-tor1-01.ssh > 198.96.85.163.49760: Flags [P.], seq 654508:654680, ack 325, win 435, length 172
20:53:16.046191 IP lamp-s-1vcpu-1gb-tor1-01.ssh > 198.96.85.163.49760: Flags [P.], seq 654680:654852, ack 325, win 435, length 172
20:53:16.046247 IP lamp-s-1vcpu-1gb-tor1-01.ssh > 198.96.85.163.49760: Flags [P.], seq 654852:655024, ack 325, win 435, length 172
20:53:16.046310 IP lamp-s-1vcpu-1gb-tor1-01.ssh > 198.96.85.163.49760: Flags [P.], seq 655024:655196, ack 325, win 435, length 172
20:53:16.046368 IP lamp-s-1vcpu-1gb-tor1-01.ssh > 198.96.85.163.49760: Flags [P.], seq 655196:655368, ack 325, win 435, length 172
20:53:16.046430 IP lamp-s-1vcpu-1gb-tor1-01.ssh > 198.96.85.163.49760: Flags [P.], seq 655368:655540, ack 325, win 435, length 172
20:53:16.046488 IP lamp-s-1vcpu-1gb-tor1-01.ssh > 198.96.85.163.49760: Flags [P.], seq 655540:655712, ack 325, win 435, length 172
20:53:16.046551 IP lamp-s-1vcpu-1gb-tor1-01.ssh > 198.96.85.163.49760: Flags [P.], seq 655712:655884, ack 325, win 435, length 172
20:53:16.046608 IP lamp-s-1vcpu-1gb-tor1-01.ssh > 198.96.85.163.49760: Flags [P.], seq 655884:656056, ack 325, win 435, length 172
20:53:16.046654 IP lamp-s-1vcpu-1gb-tor1-01.ssh > 198.96.85.163.49760: Flags [P.], seq 656056:656228, ack 325, win 435, length 172
20:53:16.046700 IP lamp-s-1vcpu-1gb-tor1-01.ssh > 198.96.85.163.49760: Flags [P.], seq 656228:656400, ack 325, win 435, length 172
20:53:16.046745 IP lamp-s-1vcpu-1gb-tor1-01.ssh > 198.96.85.163.49760: Flags [P.], seq 656400:656572, ack 325, win 435, length 172
20:53:16.046794 IP 198.96.85.163.49760 > lamp-s-1vcpu-1gb-tor1-01.ssh: Flags [P.], seq 325:361, ack 642768, win 1025, length 36
20:53:16.046854 IP lamp-s-1vcpu-1gb-tor1-01.ssh > 198.96.85.163.49760: Flags [P.], seq 656572:656744, ack 361, win 435, length 172
20:53:16.046892 IP 198.96.85.163.49760 > lamp-s-1vcpu-1gb-tor1-01.ssh: Flags [P.], seq 361:397, ack 642768, win 1025, length 36
2