root@lamp-s-1vcpu-1gb-tor1-01:~# tcpdump -r 0001.pcap
reading from file 0001.pcap, link-type EN10MB (Ethernet)
20:47:54.258002 IP lamp-s-1vcpu-1gb-tor1-01.ssh > 198.96.85.163.49760: Flags [P.], seq 1321186105:1321186149, ack 2898626808, win 435, length 44
20:47:54.258102 IP lamp-s-1vcpu-1gb-tor1-01.ssh > 198.96.85.163.49760: Flags [P.], seq 44:152, ack 1, win 435, length 108
20:47:54.258170 IP lamp-s-1vcpu-1gb-tor1-01.ssh > 198.96.85.163.49760: Flags [P.], seq 152:188, ack 1, win 435, length 36
20:47:54.260849 IP 198.96.85.163.49760 > lamp-s-1vcpu-1gb-tor1-01.ssh: Flags [.], ack 188, win 1023, length 0
20:47:57.007517 IP lamp-s-1vcpu-1gb-tor1-01.ssh > 222.186.15.10.56174: Flags [P.], seq 1898479365:1898480445, ack 512475974, win 240, options [nop,nop,TS val 3270925510 ecr 6923120], length 1080
20:48:02.285671 IP 218.92.0.202.48044 > lamp-s-1vcpu-1gb-tor1-01.ssh: Flags [S], seq 954056726, win 29200, options [mss 1460,sackOK,TS val 120161065 ecr 0,nop,wscale 7], length 0
20:48:02.285745 IP lamp-s-1vcpu-1gb-tor1-01.ssh > 218.92.0.202.48044: Flags [S.], seq 2889302652, ack 954056727, win 28960, options [mss 1460,sackOK,TS val 2642250443 ecr 120161065,nop,wscale 7], length 0
20:48:02.639521 IP lamp-s-1vcpu-1gb-tor1-01.ssh > 222.186.15.10.56174: Flags [P.], seq 0:1080, ack 1, win 240, options [nop,nop,TS val 3270931142 ecr 6923120], length 1080
20:48:03.281592 IP 218.92.0.202.48044 > lamp-s-1vcpu-1gb-tor1-01.ssh: Flags [S], seq 954056726, win 29200, options [mss 1460,sackOK,TS val 120161315 ecr 0,nop,wscale 7], length 0
20:48:03.281663 IP lamp-s-1vcpu-1gb-tor1-01.ssh > 218.92.0.202.48044: Flags [S.], seq 2889302652, ack 954056727, win 28960, options [mss 1460,sackOK,TS val 2642251438 ecr 120161065,nop,wscale 7], length 0
20:48:04.303527 IP lamp-s-1vcpu-1gb-tor1-01.ssh > 218.92.0.202.48044: Flags [S.], seq 2889302652, ack 954056727, win 28960, options [mss 1460,sackOK,TS val 2642252460 ecr 120161065,nop,wscale 7], length 0
20:48:04.524663 IP 218.92.0.202.48044 > lamp-s-1vcpu-1gb-tor1-01.ssh: Flags [.], ack 1, win 229, options [nop,nop,TS val 120161625 ecr 2642252460], length 0
20:48:04.524836 IP 218.92.0.202.48044 > lamp-s-1vcpu-1gb-tor1-01.ssh: Flags [P.], seq 1:16, ack 1, win 229, options [nop,nop,TS val 120161625 ecr 2642252460], length 15
20:48:04.533558 IP lamp-s-1vcpu-1gb-tor1-01.ssh > 218.92.0.202.48044: Flags [P.], seq 1:42, ack 1, win 227, options [nop,nop,TS val 2642252690 ecr 120161625], length 41
20:48:04.754664 IP 218.92.0.202.48044 > lamp-s-1vcpu-1gb-tor1-01.ssh: Flags [.], ack 42, win 229, options [nop,nop,TS val 120161683 ecr 2642252690], length 0
20:48:09.760056 IP 218.92.0.202.48044 > lamp-s-1vcpu-1gb-tor1-01.ssh: Flags [FP.], seq 872:896, ack 42, win 229, options [nop,nop,TS val 120162934 ecr 2642252690], length 24
20:48:13.903527 IP lamp-s-1vcpu-1gb-tor1-01.ssh > 222.186.15.10.56174: Flags [P.], seq 0:1080, ack 1, win 240, options [nop,nop,TS val 3270942406 ecr 6923120], length 1080
20:48:14.245571 IP 218.92.0.202.48044 > lamp-s-1vcpu-1gb-tor1-01.ssh: Flags [FP.], seq 872:896, ack 42, win 229, options [nop,nop,TS val 120164056 ecr 2642252690], length 24
20:48:20.981916 IP 218.92.0.202.48044 > lamp-s-1vcpu-1gb-tor1-01.ssh: Flags [FP.], seq 1:896, ack 42, win 229, options [nop,nop,TS val 120165740 ecr 2642252690], length 895
20:48:33.710704 IP 153.ip-51-254-139.eu.7777 > lamp-s-1vcpu-1gb-tor1-01.63564: Flags [S.], seq 668371184, ack 422510593, win 17520, length 0
20:48:35.322571 IP lamp-s-1vcpu-1gb-tor1-01.ssh > 218.92.0.202.51613: Flags [F.], seq 561494314, ack 3204681465, win 227, options [nop,nop,TS val 2642283480 ecr 120139321], length 0
20:48:35.594735 IP 218.92.0.202.51613 > lamp-s-1vcpu-1gb-tor1-01.ssh: Flags [R], seq 3204681465, win 0, length 0
20:48:36.431513 IP lamp-s-1vcpu-1gb-tor1-01.ssh > 222.186.15.10.56174: Flags [P.], seq 0:1080, ack 1, win 240, options [nop,nop,TS val 3270964934 ecr 6923120], length 1080
20:48:55.162979 IP baashop.ru.53066 > lamp-s-1vcpu-1gb-tor1-01.ssh: Flags [S], seq 1850169332, win 29200, options [mss 1460,sackOK,TS val 12413689 ecr 0,nop,wscale 7], length 0
20:48:55.163071 IP lamp-s-1vcpu-1gb-tor1-01.ssh > baashop.ru.53066: Flags [S.], seq 210594266, ack 1850169333, win 28960, options [mss 1460,sackOK,TS val 1870841882 ecr 12413689,nop,wscale 7], length 0
20:48:55.306509 IP baashop.ru.53066 > lamp-s-1vcpu-1gb-tor1-01.ssh: Flags [.], ack 1, win 229, options [nop,nop,TS val 12413725 ecr 1870841882], length 0
20:48:55.314516 IP lamp-s-1vcpu-1gb-tor1-01.ssh > baashop.ru.53066: Flags [P.], seq 1:42, ack 1, win 227, options [nop,nop,TS val 1870842034 ecr 12413725], length 41
20:48:55.457485 IP baashop.ru.53066 > lamp-s-1vcpu-1gb-tor1-01.ssh: Flags [.], ack 42, win 229, options [nop,nop,TS val 12413762 ecr 1870842034], length 0
20:48:55.457527 IP baashop.ru.53066 > lamp-s-1vcpu-1gb-tor1-01.ssh: Flags [P.], seq 1:22, ack 42, win 229, options [nop,nop,TS val 12413762 ecr 1870842034], length 21
20:48:55.457548 IP lamp-s-1vcpu-1gb-tor1-01.ssh > baashop.ru.53066: Flags [.], ack 22, win 227, options [nop,nop,TS val 1870842177 ecr 12413762], length 0
20:48:55.459203 IP lamp-s-1vcpu-1gb-tor1-01.ssh > baashop.ru.53066: Flags [P.], seq 42:1122, ack 22, win 227, options [nop,nop,TS val 1870842178 ecr 12413762], length 1080
20:48:55.602259 IP baashop.ru.53066 > lamp-s-1vcpu-1gb-tor1-01.ssh: Flags [P.], seq 22:462, ack 1122, win 245, options [nop,nop,TS val 12413798 ecr 1870842178], length 440
20:48:55.643507 IP lamp-s-1vcpu-1gb-tor1-01.ssh > baashop.ru.53066: Flags [.], ack 462, win 235, options [nop,nop,TS val 1870842363 ecr 12413798], length 0
20:48:55.786490 IP baashop.ru.53066 > lamp-s-1vcpu-1gb-tor1-01.ssh: Flags [P.], seq 462:510, ack 1122, win 245, options [nop,nop,TS val 12413845 ecr 1870842363], length 48
20:48:55.786558 IP lamp-s-1vcpu-1gb-tor1-01.ssh > baashop.ru.53066: Flags [.], ack 510, win 235, options [nop,nop,TS val 1870842506 ecr 12413845], length 0
20:48:55.795249 IP lamp-s-1vcpu-1gb-tor1-01.ssh > baashop.ru.53066: Flags [P.], seq 1122:1402, ack 510, win 235, options [nop,nop,TS val 1870842514 ecr 12413845], length 280
20:48:55.940246 IP baashop.ru.53066 > lamp-s-1vcpu-1gb-tor1-01.ssh: Flags [P.], seq 510:526, ack 1402, win 262, options [nop,nop,TS val 12413883 ecr 1870842514], length 16
20:48:55.983507 IP lamp-s-1vcpu-1gb-tor1-01.ssh > baashop.ru.53066: Flags [.], ack 526, win 235, options [nop,nop,TS val 1870842703 ecr 12413883], length 0
20:48:56.127114 IP baashop.ru.53066 > lamp-s-1vcpu-1gb-tor1-01.ssh: Flags [P.], seq 526:578, ack 1402, win 262, options [nop,nop,TS val 12413930 ecr 1870842703], length 52
20:48:56.127162 IP lamp-s-1vcpu-1gb-tor1-01.ssh > baashop.ru.53066: Flags [.], ack 578, win 235, options [nop,nop,TS val 1870842846 ecr 12413930], length 0
20:48:56.127291 IP lamp-s-1vcpu-1gb-tor1-01.ssh > baashop.ru.53066: Flags [P.], seq 1402:1454, ack 578, win 235, options [nop,nop,TS val 1870842846 ecr 12413930], length 52
20:48:56.270236 IP baashop.ru.53066 > lamp-s-1vcpu-1gb-tor1-01.ssh: Flags [P.], seq 578:662, ack 1454, win 262, options [nop,nop,TS val 12413965 ecr 1870842846], length 84
20:48:56.311505 IP lamp-s-1vcpu-1gb-tor1-01.ssh > baashop.ru.53066: Flags [.], ack 662, win 235, options [nop,nop,TS val 1870843031 ecr 12413965], length 0
20:48:58.266243 IP lamp-s-1vcpu-1gb-tor1-01.ssh > baashop.ru.53066: Flags [P.], seq 1454:1522, ack 662, win 235, options [nop,nop,TS val 1870844985 ecr 12413965], length 68
20:48:58.412957 IP baashop.ru.53066 > lamp-s-1vcpu-1gb-tor1-01.ssh: Flags [P.], seq 662:714, ack 1522, win 262, options [nop,nop,TS val 12414501 ecr 1870844985], length 52
20:48:58.413019 IP lamp-s-1vcpu-1gb-tor1-01.ssh > baashop.ru.53066: Flags [.], ack 714, win 235, options [nop,nop,TS val 1870845132 ecr 12414501], length 0
20:48:58.413064 IP baashop.ru.53066 > lamp-s-1vcpu-1gb-tor1-01.ssh: Flags [F.], seq 714, ack 1522, win 262, options [nop,nop,TS val 12414501 ecr 1870844985], length 0
20:48:58.415113 IP lamp-s-1vcpu-1gb-tor1-01.ssh > baashop.ru.53066: Flags [F.], seq 1522, ack 715, win 235, options [nop,nop,TS val 1870845134 ecr 12414501], length 0
20:48:58.558125 IP baashop.ru.53066 > lamp-s-1vcpu-1gb-tor1-01.ssh: Flags [.], ack 1523, win 262, options [nop,nop,TS val 12414537 ecr 1870845134], length 0
20:49:14.227007 IP 194.26.29.114.53149 > lamp-s-1vcpu-1gb-tor1-01.34078: Flags [S], seq 2810947742, win 1024, length 0
20:49:21.487538 IP lamp-s-1vcpu-1gb-tor1-01.ssh > 222.186.15.10.56174: Flags [P.], seq 0:1080, ack 1, win 240, options [nop,nop,TS val 3271009991 ecr 6923120], length 1080
20:49:37.443278 IP 218.92.0.202.34786 > lamp-s-1vcpu-1gb-tor1-01.ssh: Flags [S], seq 1651740790, win 29200, options [mss 1460,sackOK,TS val 120184853 ecr 0,nop,wscale 7], length 0
20:49:37.443393 IP lamp-s-1vcpu-1gb-tor1-01.ssh > 218.92.0.202.34786: Flags [S.], seq 170412516, ack 1651740791, win 28960, options [mss 1460,sackOK,TS val 2642345601 ecr 120184853,nop,wscale 7], length 0
20:49:38.441509 IP 218.92.0.202.34786 > lamp-s-1vcpu-1gb-tor1-01.ssh: Flags [S], seq 1651740790, win 29200, options [mss 1460,sackOK,TS val 120185103 ecr 0,nop,wscale 7], length 0
20:49:38.441563 IP lamp-s-1vcpu-1gb-tor1-01.ssh > 218.92.0.202.34786: Flags [S.], seq 170412516, ack 1651740791, win 28960, options [mss 1460,sackOK,TS val 2642346599 ecr 120184853,nop,wscale 7], length 0
20:49:39.471571 IP lamp-s-1vcpu-1gb-tor1-01.ssh > 218.92.0.202.34786: Flags [S.], seq 170412516, ack 1651740791, win 28960, options [mss 1460,sackOK,TS val 2642347629 ecr 120184853,nop,wscale 7], length 0
20:49:40.445561 IP 218.92.0.202.34786 > lamp-s-1vcpu-1gb-tor1-01.ssh: Flags [S], seq 1651740790, win 29200, options [mss 1460,sackOK,TS val 120185604 ecr 0,nop,wscale 7], length 0
20:49:40.445619 IP lamp-s-1vcpu-1gb-tor1-01.ssh > 218.92.0.202.34786: Flags [S.], seq 170412516, ack 1651740791, win 28960, options [mss 1460,sackOK,TS val 2642348603 ecr 120184853,nop,wscale 7], length 0
20:49:42.444157 IP 218.92.0.202.18177 > lamp-s-1vcpu-1gb-tor1-01.ssh: Flags [S], seq 1311280630, win 29200, options [mss 1460,sackOK,TS val 120186104 ecr 0,nop,wscale 7], length 0
20:49:42.444231 IP lamp-s-1vcpu-1gb-tor1-01.ssh > 218.92.0.202.18177: Flags [S.], seq 2869704156, ack 1311280631, win 28960, options [mss 1460,sackOK,TS val 2642350602 ecr 120186104,nop,wscale 7], length 0
20:49:42.447511 IP lamp-s-1vcpu-1gb-tor1-01.ssh > 218.92.0.202.34786: Flags [S.], seq 170412516, ack 1651740791, win 28960, options [mss 1460,sackOK,TS val 2642350605 ecr 120184853,nop,wscale 7], length 0
20:49:43.444113 IP 218.92.0.202.18177 > lamp-s-1vcpu-1gb-tor1-01.ssh: Flags [S], seq 1311280630, win 29200, options [mss 1460,sackOK,TS val 120186354 ecr 0,nop,wscale 7], length 0
20:49:43.444167 IP lamp-s-1vcpu-1gb-tor1-01.ssh > 218.92.0.202.18177: Flags [S.], seq 2869704156, ack 1311280631, win 28960, options [mss 1460,sackOK,TS val 2642351601 ecr 120186104,nop,wscale 7], length 0
20:49:44.463524 IP lamp-s-1vcpu-1gb-tor1-01.ssh > 218.92.0.202.18177: Flags [S.], seq 2869704156, ack 1311280631, win 28960, options [mss 1460,sackOK,TS val 2642352621 ecr 120186104,nop,wscale 7], length 0
20:49:45.448071 IP 218.92.0.202.18177 > lamp-s-1vcpu-1gb-tor1-01.ssh: Flags [S], seq 1311280630, win 29200, options [mss 1460,sackOK,TS val 120186855 ecr 0,nop,wscale 7], length 0
20:49:45.448128 IP lamp-s-1vcpu-1gb-tor1-01.ssh > 218.92.0.202.18177: Flags [S.], seq 2869704156, ack 1311280631, win 28960, options [mss 1460,sackOK,TS val 2642353605 ecr 120186104,nop,wscale 7], length 0
20:49:45.551506 ARP, Request who-has _gateway tell lamp-s-1vcpu-1gb-tor1-01, length 28
20:49:45.552677 ARP, Reply _gateway is-at fe:00:00:00:01:01 (oui Unknown), length 46
20:49:46.575518 IP lamp-s-1vcpu-1gb-tor1-01.ssh > 218.92.0.202.34786: Flags [S.], seq 170412516, ack 1651740791, win 28960, options [mss 1460,sackOK,TS val 2642354733 ecr 120184853,nop,wscale 7], length 0
